{
  "contracts": {
    "schema_valid": true,
    "schema_version": "kernrift_contracts_v1",
    "utf8_valid": true
  },
  "diagnostics": [],
  "hash": {
    "computed_sha256": "ff41e03e89d83603026e1a71e5e17d806786a6b75cd4d4c8d2fee15facfb0f2b",
    "expected_sha256": "ff41e03e89d83603026e1a71e5e17d806786a6b75cd4d4c8d2fee15facfb0f2b",
    "matched": true
  },
  "inputs": {
    "contracts": "contracts.json",
    "hash": "contracts.sha256",
    "pubkey": null,
    "sig": null
  },
  "result": "pass",
  "schema_version": "kernrift_verify_report_v1",
  "signature": {
    "checked": false,
    "valid": null
  }
}
